Parsed test spec with 3 sessions

starting permutation: s3_vacuum build s3_wake s2_begin s2_delete s3_insert s3_scan_end s3_await_defer s2_commit s3_build_end
step s3_vacuum: VACUUM cic_uniq;
step build: CREATE UNIQUE INDEX CONCURRENTLY cic_uniq_idx ON cic_uniq(k); <waiting ...>
step s3_wake: SELECT injection_points_wakeup('heap_reset_scan_snapshot_swap');
injection_points_wakeup
-----------------------
                       
(1 row)

step s2_begin: BEGIN;
step s2_delete: DELETE FROM cic_uniq WHERE k = 1;
step s3_insert: INSERT INTO cic_uniq VALUES (1, 'y');
step s3_scan_end: 
    SELECT injection_points_detach('heap_reset_scan_snapshot_swap');
    SELECT injection_points_wakeup('heap_reset_scan_snapshot_swap');

injection_points_detach
-----------------------
                       
(1 row)

injection_points_wakeup
-----------------------
                       
(1 row)

step s3_await_defer: 
    DO $$
    DECLARE tries int := 0;
    BEGIN
        WHILE tries < 200 LOOP
            PERFORM 1 FROM pg_stat_activity
             WHERE wait_event = 'bt_load_defer_unique_check';
            EXIT WHEN FOUND;
            PERFORM pg_sleep(0.05);
            tries := tries + 1;
        END LOOP;
    END $$;

step s2_commit: COMMIT;
step s3_build_end: 
    SELECT injection_points_detach('bt_load_defer_unique_check');
    SELECT injection_points_wakeup('bt_load_defer_unique_check');

injection_points_detach
-----------------------
                       
(1 row)

injection_points_wakeup
-----------------------
                       
(1 row)

step build: <... completed>

starting permutation: s3_vacuum build s3_wake s2_begin s2_delete s3_insert s3_scan_end s3_await_defer s2_rollback s3_build_end
step s3_vacuum: VACUUM cic_uniq;
step build: CREATE UNIQUE INDEX CONCURRENTLY cic_uniq_idx ON cic_uniq(k); <waiting ...>
step s3_wake: SELECT injection_points_wakeup('heap_reset_scan_snapshot_swap');
injection_points_wakeup
-----------------------
                       
(1 row)

step s2_begin: BEGIN;
step s2_delete: DELETE FROM cic_uniq WHERE k = 1;
step s3_insert: INSERT INTO cic_uniq VALUES (1, 'y');
step s3_scan_end: 
    SELECT injection_points_detach('heap_reset_scan_snapshot_swap');
    SELECT injection_points_wakeup('heap_reset_scan_snapshot_swap');

injection_points_detach
-----------------------
                       
(1 row)

injection_points_wakeup
-----------------------
                       
(1 row)

step s3_await_defer: 
    DO $$
    DECLARE tries int := 0;
    BEGIN
        WHILE tries < 200 LOOP
            PERFORM 1 FROM pg_stat_activity
             WHERE wait_event = 'bt_load_defer_unique_check';
            EXIT WHEN FOUND;
            PERFORM pg_sleep(0.05);
            tries := tries + 1;
        END LOOP;
    END $$;

step s2_rollback: ROLLBACK;
step s3_build_end: 
    SELECT injection_points_detach('bt_load_defer_unique_check');
    SELECT injection_points_wakeup('bt_load_defer_unique_check');

injection_points_detach
-----------------------
                       
(1 row)

injection_points_wakeup
-----------------------
                       
(1 row)

step build: <... completed>
ERROR:  duplicate key value violates unique constraint "cic_uniq_idx"
